Defense Minister Waldir Pires defended Brazil's air traffic control system as one of the most secure in the world in testimony before Congress on Wednesday.	1
The committee declared that it will not end the strike until the authorities fulfill its demands.	3
U.S. President Donald Trump meets Mexico's President Enrique Pena Nieto during the their bilateral meeting at the G20 summit in Hamburg, Germany July 7, 2017.	1
Four Taliban members met Alice Wells, a senior US state department official, at a hotel in the Qatari capital on 23 July for the first face-to-face talks in seven years.	1
On 17 July 2017 Russia's Supreme Court rejected an appeal lodged by the Administrative Centre of the Russian branch of Jehovah's Witnesses against the Supreme Court decision of 20 April which had upheld a ruling categorising them as 'extremists'.	3
The United States, India, Israel, Pakistan and other governments have sent emergency supplies and personnel such as doctors to Nepal.	2
Father Emmanuel Yousaf said that the government must ensure security and protection for the church leaders and for all religious minorities.	3
The United States has imposed sanctions against the Russian space organization Glavkosmos and the Indian Space Research Organization (ISRO) because of the transfer of rocket engine technology.	3
Pyongyang has violated a ban by UN on ballistic missile tests.	3
Fiji's Governor General Ratu Sir Penaia Ganilau said today that he has refused to swear in coup leader Lt. Col. Sitiveni Rabuka and his ministers and announced plans to call elections in the Pacific island.	3
Taliban fighters seized a house in eastern side of the city and fired rounds of rockets on Hamid Karzai International Airport at around midday, causing a suspension to the flights.	4
Anti-war groups called on low-wage workers and community activists to mobilize against U.S. war moves in Ukrain.	3
Israel has launched cyber warfare against. Iran and Lebanon.	4
2 Militant arrested: Indonesian police have arrested a man believed to be the leader of the al Qaeda-linked Jemaah Islamiyah network who has eluded capture since 2003, authorities said Monday.	4
Government military officials and a section of the opposition Sudan People’s Liberation Army in Opposition (SPLA-IO) agreed to allow humanitarian access and facilitate free movement of people and goods.	1
The Mauritius government said last week that it would seek compensation from the owner of the Japanese freighter over the oil leakage.	3
Russia and Turkey's foreign ministers met briefly today following a spate of tensions over clashes in Syria's Idlib, where the Syrian army -- backed by Russian airpower -- has launched an offensive to retake rebel-held territory that has left Turkish troops dead.	1
China has established diplomatic ties with El Salvador, after the country broke off links with Taiwan.	1
Former US President Barack Obama on Sunday held separate talks with President Uhuru Kenyatta in Nairobi.	1
Congress will fully support the Philippine Plan of Action to End Violence Against Children (PPAEVAC), Davao City Rep. Karlo Nograles said yesterday.	1
EU provides €45m support for agri-businesses in Nigeria and other African countries.	2
France suspended a 3% digital tax on U.S. tech companies.	2
Reliance Jio has agreed to set up a cable landing station at Digha.	1
The Taliban rejected on Monday an Afghan government offer of a ceasefire and they would persist with their attacks.	3
U.S. is pushing hard Palestinian state for a negotiated settlement with Israel sooner.	3
Imam Suliman Gani demanded a serious, immediate apology from the Prime Minister.	3
Earlier this year, the US ambassador to Berlin warned the German government in a letter that Washington would consider scaling back intelligence co-operation should Huawei be given a role in the 5G rollout.	3
Israel has agreed to open its borders with Gaza to allow humanitarian aid and reconstruction materials into the war-battered Palestinian enclave.	1
A group of Saudi hackers launched cyber attacks on a number of Iranian government websites in May.	4
The U.S. State Department pledged support for Hungarian NGOs and free media, though no further details have been released.	1
South Sudanese authorities on Friday released two former high-ranking followers of rebel leader Riek Machar who were facing death sentences.	2
Malloy says Syrian Refugees granted asylum are welcome in Connecticut.	2
Prime ministers John Major of Britain and John Bruton of Ireland agreed to the dual track approach which calls for the decommissioning of paramilitary weapons while holding peace talks.	1
Egypt's Cassation Court rejected an appeal against initial rulings passed by a Giza criminal tribunal in December 2017.	3
A Zimbabwean court on Tuesday freed activist pastor Evan Mawarire, a critic of President Robert Mugabe, following his weekend arrest on new charges of attempting to subvert the government.	2
Taliban suicide bombers have killed at least 48 people and wounded dozens more in two bomb blasts in Afghanistan.	4
On March 29, by a 286-344 vote, Britain's parliament rejected the EU withdrawal agreement for a third time.	3
U.S. Trade Representative Robert B. Zoellick and Kuwaiti Minister of Commerce and Industry Abdullah Al Taweel today signed an agreement creating a framework for increased trade and investment between Kuwait and the United States.	1
ISLAMABAD: The Japanese government has provided $49 million grant assistance for the extension of intensive care at maternal and child health care centre and children's hospital at the Pakistan Institute of Medical Sciences (PIMS) and to strengthen cargo inspection capacity at dry ports of the country.	2
Indian police have imposed a curfew in parts of the western city of Ahmedabad after deadly clashes between Hindu and Muslim gangs continued into the early hours of Saturday.	4
Canadian Prime Minister Jean Chretien said Monday that Iraqi President Saddam Hussein could not be allowed to flout United Nations inspections of Iraq's chemical and biological weapons program.	3
The group al-Nusra Front will not release the soldiers and policemen without anything in return.	3
US President Donald Trump's son-in-law and senior adviser has quietly held talks in the Saudi capital, Riyadh, with King Salman bin Abdulaziz Al Saud and Crown Prince Mohammed as part of a tour of the Middle East.	1
The Vice President announced the U.S. government had provided $340 million for assistance in northern Iraq, focusing on helping full inclusion, tolerance, and protection of the rights of religious minorities.	2
The National Highway Traffic Safety Administration is dispatching a team to Detroit to investigate a collision involving a Tesla that collided with a semitrailer.	3
The U.S. military launched air and artillery strikes on Syrian government-backed troops after some 300 attackers launched what appeared to be a coordinated assault on Syrian opposition forces accompanied by U.S. advisers in the province of Deir el-Zour.	4
Somalia’s al Shabaab fighters attacked a military base outside the capital Mogadishu using car bombs and guns, killing 17 soldiers and taking control of the base and a nearby town, the group said on Friday.	4
WASHINGTON -- U.S. President Donald Trump's reelection campaign has filed a libel lawsuit against The New York Times (NYT), accusing it of falsely asserting a trade-off between Russian officials and the president's 2016 campaign.	3
The Philippine government has rejected the call of the European Parliament and told the international community to refrain from influencing De Lima's case.	3
US President Donald Trump set a 30-day deadline for the UN health agency to make significant reforms or risk losing funding.	3
Foreign Minister Urmas Paet said the European Union must be ready to mediate crisis negotiations in Ukraine.	3
The Thiruvananthapuram city police have arrested a youth for an alleged chain-snatching attempt made on an IPS trainee a few days ago.	4
United States must continue military aid to Egypt in order to ensure access to the Suez Canal and Egyptian airspace.	2
Members of New York's Congressional delegation on Saturday demanded the removal of President Donald Trump from office.	3
"WASHINGTON (AP) "" President Donald Trump on Wednesday granted a full pardon to Conrad Black, a former newspaper publisher who has written a flattering political biography of Trump.Black's media empire once included the Chicago Sun-Times and The Daily Telegraph of London."	2
At the 2019 event, the United States' International Development Finance Corporation (DFC) signed a $5 billion facility agreement with the African Development Bank.	1
The government refused to allow the Aalan Kurdi to dock.	3
The United Nations is willing to send more resources to Colombia to help the Andean country care for hundreds of thousands of Venezuelans fleeing food shortages and economic devastation in their homeland.	1
In October, a Taliban suicide bomber killed 15 Afghan Army trainees as they travelled home from the Marshal Fahim academy.	4
Sri Lanka police on Monday arrested a local employee of the Swiss Embassy in Colombo, who has been at the centre of a diplomatic controversy, for allegedly making a false accusation that she was detained and threatened.	4
Hezbollah group systematically used Lebanese civilians as human shields, cynically endangering their lives and well being.	4
The Libyan National Army (LNA) agreed on 18 September to lift a blockade on oil exports and production which it had imposed in January.	1
Syrian authorities have freed prominent blogger Razan Ghazzawi, arrested last week during a security raid on the Syrian Centre for Media and Freedom of Expression.	2
Soldiers from the NDC-R have surrendered to the Congo government just over a month after they attempted to overthrow the group’s leader.	2
The UN-brokered ceasefire in Yemen's Hudaydah and its surroundings will start on Tuesday, a United Nations official said after renewed fighting in the strategic city.	2
Erdogan will meet European Council President Donald Tusk and European Commission President Jean-Claude Juncker in Bulgaria’s Varna at a summit on March 26.	1
The U.S. State Department has issued a heightened travel warning for Sri Lanka after last Sunday's suicide bombings that killed more than 250 people.	3
Dozens of Russian peacekeepers destined for Nagorno-Karabakh began deploying Tuesday, hours after Armenia and Azerbaijan agreed to halt fighting over the separatist region.	2
Sri Lankan Tamil rebels have said that they will release two homeguards held captive by them on Monday.	1
The UNSC has imposed sanctions on Lebanon in relation to the 2005 terrorist bombing in Beirut, as well as in response to the 2006 conflict between Israel and Hezbollah.	3
Foreign Minister H E Dr Khalid bin Mohamed Al Attiyah said that all political forces in Yemen must provide the necessary support to the legitimate Yemeni authorities, to achieve the aspirations of the Yemeni people.	3
The British Parliament rejected Prime Minister Theresa May's agreement on withdrawal from the European Union.	3
In 2011, the FBI arrested more than 100 mob members, including the alleged street boss of the Colombo family.	4
Israel will not release prisoners and detainees who acted against the laws of war.	3
New Zealand police said they have detained four people in connection with deadly shootings at two mosques in Christchurch on Friday.	4
Unidentified gunmen beheaded three men and torched a boys' school in Nangarhar province in eastern Afghanistan late on Saturday, in an attack officials blamed on Islamic State militants.	4
Following an emergency meeting of the Council of Foreign Ministers of the member states of OIC in the Saudi city of Jeddah on Sunday, the OIC expressed its total rejection and strong condemnation of the Israeli Prime Minister's declaration, to annex the Jordan Valley in the occupied West Bank if re-elected in September 17 polls.	3
Vice-President Hamilton Mourao on Tuesday defended Brazil's environmental policies, saying the country was working to protect the Amazon.	1
The Taliban on Sunday revoked their ban on the International Committee of the Red Cross (ICRC) in Afghanistan and gave a guarantee of security for its staff doing humanitarian work in areas under their control.	2
Hezbollah threatened to shell Haifa, Israel's third largest city, if Israel hits Beirut and its Shiite suburbs.	3
Eritrea has expelled some of the U.N. peacekeepers, raising fears of renewed hostilities with neighboring Ethiopia.	3
The Office of Inspector General opened fraud investigations against each of the top 25 providers, which has caused more injury and damages to him,” the complaint states.	3
The Bangladeshi government has ordered an investigation against Grameen Bank, the institution which was founded by Muhammed Yunus, winner of the 2006 Nobel Peace Prize.	3
Jordan and Britain have agreed to undertake joint military exercises this month but insisted that the maneuvers were in no way linked to neighbouring Iraq.	1
Texas League of United Latin American Citizens (LULAC) is demanding resignation or removal of Senator Ted Cruz for inciting acts of sedition.	3
U.S. President Donald Trump will make a state visit to the United Kingdom in June according to an official statement released by Buckingham Palace.	1
NLRB General Counsel Peter Robb has declined to resign from him position, despite President Biden's request he do so.	3
In Colombia, the ELN declared a monthlong ceasefire on 1 April.	2
BANGKOK -- The U.S. government has imposed sanctions on a Thailand-based company it says provides services to an Iranian airline that Washington accuses of supporting terrorist activities directed by Iran's government.	3
In Iraq, U.S. troops are involved in a variety of stability tasks, including nation-building activities that have been undertaken in some peacekeeping operations.	2
The government conceded to demands that Guineans overseas, a group regarded as largely favouring the opposition, should be allowed to vote.	2
The White House has defended US President Donald Trump's decision to miss a memorial event on Saturday after he faced a backlash.	1
ADDIS ABABA, May 15 (Xinhua) -- Ethiopian Minister of Foreign Affairs Gedu Andargachew on Wednesday reiterated the Ethiopian government's support to the ongoing negotiations among Sudanese stakeholders.	1
UNITED NATIONS (AP) -- Congo is boycotting two planned U.N. events focusing on the central African nation because it was not consulted on the agenda or expected outcome, the president's top adviser said Wednesday.	3
Two conservative newspapers were ordered to suspend publication yesterday.	3
The United States is the leading international donor to Sudan, providing more than $5 billion in assistance to Sudan since 2005, including $3.7 billion in humanitarian and peacekeeping assistance to Darfur.	2
Washington: US President Donald Trump has said he would call Saudi Arabia's King Salman on missing dissident journalist Jamal Khashoggi who is feared killed at the kingdom's consulate in Turkey.	1
Secretary-General Antonio Guterres will be attending the Arab League summit in Tunis this weekend.	1
Disha Ravi was arrested by Delhi Police for collaborating with a pro-Khalistani outfit to spread disaffection against India.	3
At week's end, Duvalier indignantly demanded a meeting of the U.N. Security Council to investigate this latest armed aggression against his dark fiefdom.	3
United States suspended military aid to Indonesia due to human rights concerns during that country's conflicts in East Timor and Aceh.	3
MOSCOW -- A Moscow court on Tuesday found a Norwegian man guilty of espionage and sentenced him to 14 years in a high-security prison.	3
Mexican President Andrés Manuel López Obrador on Thursday defended Mexico’s restrictive immigration policy.	1
The Afghan government will gradually release 5,000 Taliban prisoners starting this week if the insurgents significantly reduce violence, President Ashraf Ghani's spokesman said Wednesday, paving the way for peace talks following a U.S. withdrawal deal.	1
NSW Premier Gladys Berejiklian has issued an ultimatum to her Nationals colleagues after they threatened to sit on the cross bench because of a dispute over the state's koala protection policy.	3
Ali Kushayb, a Sudanese militia leader charged with 50 crimes against humanity and war crimes related to the conflict in Darfur, has surrendered to the authorities.	2
The war game, code-named infinite moonlight 96 was staged by U.S. marines and Jordanian armed forces.	2
Germany is a long-standing partner of WFP’s assistance in South Sudan and has contributed close to US$141 million since independence in 2011.	2
China's Premier Li Keqiang and his Pakistani counterpart Imran Khan signed 15 agreements and memorandums of understanding in the Great Hall of the People in the Chinese capital, pledging stronger cooperation in fields such as poverty alleviation, agriculture, industry and science.	1
NATO allies have agreed to extend their peacekeeping mission in the troubled Balkan republic for another three months.	1
New York (CNN)French President Emmanuel Macron firmly rejected any military solution to the North Korean crisis and warned against scrapping the nuclear agreement with Iran, in an exclusive interview Tuesday with CNN.	3
Delhi Police, on Thursday, arrested an alleged sharpshooter of the 'Neeraj Bawana' gang after an encounter in the early hours in northwestern Delhi's Bawana.	4
116 people arrived in Kyrgyzstan seeking a refuge in early 2017, the State Migration Service's report for 2016 reads.	3
Police in Japan have issued an arrest warrant for Chinese actor Jiang Jinfu after he admitted to beating his Japanese former girlfriend, news site Sina reported on Tuesday.	4
"The European Union slammed US President Donald Trump's Middle East peace plan on Tuesday, arguing that it ""departs from"" international agreements on the Israel-Palestine conflict."	3
Bahrain’s High Criminal Court convicted Iran’s Future Bank on money laundering charges.	3
And Amnesty International put out a report accusing the Nigerian army of failing to respond to warning signs before the mass kidnapping.	3
Armenian-backed militias violated ceasefire in occupied Karabakh 115 times in last 24 hours.	4
Israeli Prime Minister Benjamin Netanyahu's strongest election rival, former army general Benny Gantz, said on Tuesday he would seek peace with the Palestinians but stopped short of endorsing their goal for statehood.	1
Ireland has already provided over €3.5 million in humanitarian funding to Lebanon in 2020.	2
"GAZA CITY, Gaza Strip -- International labor officials applaud the Palestinian government's recent decision to ban brokerages that ""blackmail"" Palestinians seeking permits to work in Israel."	1
US President Donald Trump has defended Russia over claims of interference in the 2016 presidential election.	1
At a time when Africa is trying to modernize, Britain and France have agreed to act more closely to help African states achieve their goal.	1
UTRECHT, Netherlands (Reuters) - Dutch police arrested a Turkish man suspected of shooting dead three people and wounding five on a tram in the Dutch city of Utrecht on Monday.	4
Tobago's authorities have deported at least 165 Venezuelans in recent weeks.	4
Afghan President Ashraf Ghani on Thursday announced a weeklong cease-fire with the Taliban to coincide with the holiday marking the end of Ramadan next week.	2
In 2018, the U.S. court awarded the Warmbiers US$501.14 million from the North Korean regime.	2
"CAIRO (AP) "" Acting on a judge's order, Egyptian police detained the sons of former president Hosni Mubarak on Saturday along with three others in connection with insider trading charges for which the five are on trial, security officials said."	4
"U.S. President Donald Trump said Wednesday he received a ""great letter"" from Kim Jong Un and will likely meet with the North Korean leader in the near future."	1
Congo is boycotting two planned U.N. events focusing on the central African nation because it was not consulted on the agenda or expected outcome, the president's top adviser said Wednesday.	3
US envoy Richard Holbrooke ended mediation efforts between Albanian separatists, but announced he'd return soon.	3
Clinton has said he will not lift the embargo until he is satisfied Vietnam is doing all it can to help determine the fate of more than 2,200 Americans still listed as missing from the nation's longest war.	3
Hundreds of employees stopped work on Tuesday in a strike complaining of changes in the wake of Nokia’s sale of its mobile phones business to U.S. software giant Microsoft.	4
The Nigerian Air Force (NAF) on Wednesday reiterated its commitment to support the Nigeria Police, Department of State Services (DSS) and other security agencies with real time geospatial and imagery intelligence whilst making available its air assets for the conduct of tactical air support missions and ‪increasing the frequency of air reconnaissance in the affected areas.	1
Bolivian President Evo Morales declared a state of siege in Pando, and dispatched the army to move on Cobija in order to retake its airport, which had been occupied by right wing bands.	4
Several left-wing and liberal US Jewish organisations have rejected US President Donald Trump's proposal to solve the Israeli-Palestinian conflict.	3
Britain's Royal Marines said it will not release the Iranian oil tanker unless it can prove it was not breaking European sanctions on oil shipments to Syria.	3
US and Western allies launch war games near Iran waters.	2
Naroda Police have been pressuring the workers at the textile unit of Reliance Industries Limited (RIL) to call off the strike.	3
WASHINGTON - The Senate has confirmed President Donald Trump's nominee for a Philadelphia-based appeals court, despite opposition from the nominee's two home-state senators.	2
Roberts says the U.S. military is training Iraqi pilots to fly F-16s at the request of Iraq's government.	2
Author: AP ID: 1555145460074546400 Sat, 2019-04-13 12:40 KABUL: The Taliban ambushed a police convoy in western Afghanistan, killing seven security forces, an official said Saturday.	4
Turkish authorities have deported more than 16,000 Syrians to Idlib this year, including more than 1,900 people in September.	4
Turkey and Syria are violating the ceasefire agreement by continuing to battle last night.	4
Hours before Saturday's announcement, Taliban militants stormed an Afghan military base in the western province of Herat, killing at least 17 soldiers, officials said.	4
Ukraine will send a team of experts to Iran later on Wednesday to investigate the circumstances of the crash of an Ukrainian airliner, President Volodymyr Zelenskiy said after meeting government officials.	3
"A three-judge panel of the Jerusalem District Court on Wednesday unanimously rejected Prime Minister Benjamin Netanyahu's request for an exemption from attending the opening of his public corruption trial which will take place on Sunday.The decision appeared to be a move by the court to set the tone that it is in control now that the trial is actually starting, regardless of the fact that ""Defendant No."	3
Zulu nationalist leader Mangosuthu Buthelezi on Tuesday angrily rejected President Nelson Mandela's threat to cut off funding to KwaZulu/Natal province if the Inkatha Freedom Party continued to make threats against the central government.	3
France will not lift the ban on UK unconditionally.	3
Zimbabwean President Robert Mugabe has warned British High Commissioner Brian Donnelly that his government would expel him if he continued interfering in the internal affairs of the country by helping the opposition Movement for Democratic Change (MDC) stage illegal and violent demonstrations.	3
Secretary of State Rex Tillerson and Russian Foreign Minister Sergey Lavrov will attend the meeting between President Trump and President Vladimir Putin at the G20 summit, along with translators for each side.	1
Yemen's warring parties have agreed to a ceasefire in Hodeidah, a major flashpoint in the country's war.	1
The United States has provided the Lebanese Armed Forces (LAF) with aircraft, vehicles, weapons, and other equipment to help keep the country’s borders secure and conduct counterterrorism operations.	2
The Sao Paulo state government conceded yesterday to demands from the Neighborhood Association to block construction of a subway station.	2
Russia's president, Mr Vladimir Putin, launched a mediation effort between India and Pakistan in the Kashmir crisis last night.	1
The jornalist Moussa Tchangari was arrested on Monday in Niger for collaborating with Boko Haram Islamists earlier this week.	3
Russian President Vladimir Putin has said that if Snowden releases any more of the materials, Russia will not grant him temporary asylum.	3
US House Speaker Nancy Pelosi and other senior members of Congress have held talks in Jordan with King Abdullah II and top Jordanian officials.	1
"Palestinian President Mahmoud Abbas's office condemned Netanyahu's decision to advance construction in E1, saying it would violate international law and ""push things to the abyss."""	3
Germany agreed to accept more than 1,500 people now living in Greek refugee camps.	1
Philippine troops remained on alert in Manila after BIFF gunmen tried to set off improvised bombs along roads leading to the clash site.	4
Japanese and the Australian armies have agreed to undertake joint military exercises.	1
Vladimir Putin has hosted Saudi King Salman for talks at the Kremlin, in the first official visit to Russia by a reigning Saudi monarch.	1
