Nigerian Air Force (NAF) says it has killed several Boko Haram terrorists after an air strike on a building where the terrorist were holding meeting in Sambisa forest.	4
The Romanian government has agreed to set up a special evacuation transit centre for refugees in Yemen.	1
"Jeremy Hunt, the Foreign Secretary, on Thursday dismissed the suggestion of a prisoner swap for a British-Iranian mother being held in Tehran as a ""vile"" diplomatic ploy."	3
Yemen let free activists in the face of Tunisia-inspired protesters.	2
Yemeni army soldiers, supported by allied fighters from Popular Committees , have reportedly carried out an aerial attack against an important military target in the country’s western coastal province of Hudaydah in retaliation for the Saudi-led devastating military aggression against their impoverished homeland.	4
The Taliban have refused official talks with President Ashraf Ghani´s government, believing it is illegitimate.	3
Tehran, March 15, IRNA - Secretary-General of the Permanent Secretariat of the International Conference of Support for Palestinian People in the Iranian Parliament condemned the Zionist regime's brutal attacks on the Palestinian people in Gaza.	3
Ukrainian security forces arrested Leonid Kozhara, who served as foreign minister in the pro-Russian government led by exiled president Viktor Yanukovych, on suspicion of pre-meditated murder on Wednesday.	4
Clinton Administration sharply reduced military aid to the Colombian army because of its poor record on human rights.	3
New Colombian President Mr Alvaro Uribe has declared a state of emergency in Colombia to fight what the government described as a regime of terror following a surge of war violence.	4
A court in Venezuela has banned national newspapers from printing graphic photographs of murders and violence.	4
On February 25, Home Minister Amit Shah had discussed the situation with the Delhi chief minister and leaders of various parties.	1
Germany on Tuesday summoned the Chinese ambassador in Berlin to complain about the move, saying sanctions against EU lawmakers, scientists, political institutions and non-governmental organizations represented an unreasonable escalation that will unnecessarily strain relations between the EU and China.	3
Jose Vasconcelos defended Mexico's racial and ethnic mestizaje as a superior form of modern amalgamation.	1
Israeli troops remained on alert in North District amid heightened tensions.	4
TEHRAN -- On the eve of a visit by Iran's moderate president, Hassan Rouhani, to the United States, the Iranian authorities on Wednesday unexpectedly freed 11 of Iran's most prominent political prisoners, including Nasrin Sotoudeh, a human rights lawyer.	2
Erdogan will meet his counterpart Italian President Sergio Mattarella at a working lunch in Rome.	1
Senate President, Bukola Saraki, will on Tuesday, June 19, lead a Senate delegation on a three-day parliamentary visit to Russia.	1
Pro-Islamic Welfare Party (RP) leader Necmettin Erbakan returned the mandate to President Suleyman Demirel for the formation of a new coalition government as Erbakan failed in forming the government, a statement from the press office of the presidential palace declared this evening.	2
Colombia is ready to contribute troops to the NATO-led security force in Afghanistan, the Andean nation's defense minister said here.	1
An Ethiopian rebel group declared a unilateral ceasefire on Thursday after parliament removed it from a list of banned terrorist groups as part of a reform drive led by the new prime minister.	2
Leaders of LAUSD Union of Teachers have said they will not end the strike until their members ratify a contract, but also said they have a system in place that could.	3
An Istanbul court this week freed a Turkish consulate employee accused of involvement in a coup attempt against Erdogan from house arrest for health reasons, widely seen as a friendly gesture ahead of Erdogan's meeting with Trump.	2
Peter Biar Ajak was released Saturday after South Sudan President Salva Kiir pardoned him along with 30 prisoners.	2
Rebel fighters in the Deraa countryside said they will lay down their weapons and accept state rule last Friday.	1
The Delhi High Court on Friday ordered release of former youth Congress leader Sushil Kumar Sharma, who has been serving life term for the murder of his wife Naina Sahni in 1995.	2
South Sudanese rebels will not release the two Kenyan pilots until compensation is paid to the family of a civilian killed when their plane crashed, a rebel spokesman told Reuters on Tuesday.	3
Maduro’s vice president has violated a EU’s ban on entry into Spanish territory.	3
Hungarian Prime Minister Viktor Orban on Thursday pledged his full support for an Italian-Polish initiative to form a right-wing alliance for European Parliament elections due in May.	1
President Donald Trump and Senate Republicans have rejected Ford's request for an FBI investigation of her accusation, which she says should take place before she testifies.	3
North Korean leader Kim Jong Un arrived in Russia by train on Wednesday, a day before his much-anticipated summit with President Vladimir Putin that comes amid deadlocked diplomacy on his nuclear program.	1
The rebel Free Syrian Army on Wednesday threatened to shell positions of the powerful Hezbollah militant group in neighbouring Lebanon after accusing it of firing across the border into territory it controls.	3
European bar lifts 4-Year boycott of U.S. products after Trump's exit.	2
The United States lifted long-standing sanctions against Sudan on Friday, saying it had made progress fighting terrorism and easing humanitarian distress.	2
Lagumdzija suspended humanitarian aid donations for Sarajevo until aid was delivered to the eastern enclaves.	3
Mikhail Gorbachev announces that he is resigning as president of the Soviet Union.	2
After an emergency foreign ministers' meeting in the Red Sea city of Jeddah, the OIC expressed its total rejection and strong condemnation of the Israeli Prime Minister's declaration.	3
New York, May 17, IRNA - Iran's Ambassador and Permanent Representative to the United Nations rejected a military solution for Syrian crisis, saying only Syrian themselves will determine their fate.	3
A spokesman for President Ashraf Ghani on Wednesday disputed the results and methodology of the U.N. report, saying the government is committed to protecting civilians.	3
In a session held April 1, the Iraqi parliament rejected the Kirkuk council decision and voted in favor of displaying only the Iraqi flag on public buildings in Kirkuk.	3
Ukraine and Russia, overseen by France, Germany and the Organization for Security and Cooperation in Europe (OSCE), signed two agreements in the Belarusian capital, Minsk -- in September 2014 and February 2015 -- to establish a cease-fire and a road map to a lasting peace in eastern Ukraine.	1
The United States on Friday suspended military aid to Mali after a group of rebel military officers seized power and placed the West African country’s president under arrest.	3
A Saudi-led strike on a Yemeni school bus that led to the deaths of 40 children used a Lockheed Martin-made MK 82 guided bomb.	4
In that case, the Bank of Nova Scotia refused to respond to a request from the U.S. authorities for banking information because the information was kept in the Bahamas.	3
The Palestinian government, thus, rejects and condemns the US administration's decision, and calls it a clear violation to the international legitimacy's resolutions and all humanitarian and international laws, said Al-Mahmoud.	3
SOS Fauna returned the confiscated songbirds captured from illegal wildlife trade back into the Brazilian wild.	2
The foundation later issued a statement denouncing the Reuters story.	3
On Tuesday evening, Israeli military jets carried out several air strikes in the northern Gaza Strip, killing a 24-year-old Hamas militant and injuring four others.	4
Russia has strengthened its forces in Crimea amid ongoing confrontation with Ukraine in the Kerch Strait and the Sea of Azov.	4
ISIS gunmen killed four Kurds in a Kirkuk province village.	4
Russian President Vladimir Putin has welcomed US President Donald Trump's decision to send troops home from Syria after declaring victory over ISIL.	1
The Southeast Asian nations pledged full support for Seoul's efforts to denuclearize the peninsla and create a peace regime.	1
Meanwhile, opposition leaders in Chad's capital, Ndjamena, have announced they are boycotting the presidential poll.	4
In November, the Egyptian affiliate of the Islamic State launched a brazen attack in which nearly 40 gunmen stormed the al-Rawdah mosque in Egypt’s sparsely populated Sinai, killing more than 300 worshippers.	4
The March 17 explosion that leveled the building in the district of New Mosul killed more than 100 people as Iraqi forces were battling Islamic State group militants in the area.	4
The church leader Saboi Jum launched a mediation effort between the Kachin Independence Organization (KIO) and the Ne Win military government.	1
The Department of Education will investigate Yale, along with other institutions of higher education across the country, for allegedly failing to report billions of dollars in foreign funding.	3
The UN withdrew peacekeepers from Sinai allowing Nasser to mass his divisions on Israels border.	3
France's representative to the UNSC said Trump's deal cements despair for young people in Palestine, calling out the deal for rejecting long-standing international standards.	3
Armenian President Serzh Sargsyan and Azerbaijani President Ilham Aliyev agreed to continue their work on the political settlement to the conflict and instructed their foreign ministers to speed up the negotiation process.	1
US President Donald Trump has sent a letter to the head of the World Health Organization (WHO) threatening to pull US funding permanently over Covid-19.	3
Britain has sent 100 armoured patrol vehicles and a team of paratroopers to Lebanon to help the country patrol its borders and stop terrorists, drugs and weapons from entering Europe.	2
The United States has issued an ultimatum to Sudan to normalize diplomatic relations with Israel within 24 hours if the African country wants to be removed from the list of terror sponsors, London-based Asharq Al-Awsat reported.	3
A U.S. congressional report called for sanctions against China over human rights abuses.	3
Iraqi forces today started their assault on Mosul's Old City as they press their battle to retake the northern city from the Islamic State group , an army commander said.	4
Canada and the United Kingdom have agreed to a rollover trade deal, the countries announced on Saturday, promising to negotiate a more comprehensive agreement after the UK’s post-Brexit transition period ends.	1
Kuwait launched a mediation effort between the National Democratic Alliance and Hadas.	1
The missiles fired by the Israeli military struck an arms depot of the Syrian army or its allied forces after midnight.	4
On March 29, by a 286-344 vote, Britain's parliament rejected the EU withdrawal agreement for a third time.	3
Maduro has now closed Venezuela’s land borders with Brazil and Colombia, and severed diplomatic ties with Colombia.	4
Israel’s Supreme Court has rejected appeals against the demolition of a Bedouin village in the occupied West Bank whose fate has been a subject of international concern.	3
Mexico and the United Kingdom signed an agreement to continue trading after the UK leaves the EU.	1
South Sudan mediator Tut Galuak said the Sudanese government has started direct talks with The Sudan Revolutionary Front, an alliance of rebel groups, which has joined the protest movement against al-Bashir but did not fully support the power-sharing deal with the military.	1
Saudi Arabia has imposed blockades on Saudi air and sea ports following the operation to prevent Houthi rebels from getting arms supplies.	4
Russia has so far refused to deploy peacekeepers in the region.	3
At a summit between Russia, Iran and Turkey on Friday, President Vladimir Putin rejected Erdogan's call for a truce in Idlib, home to about 3 million civilians.	3
Denmark last week announced a suspension of aid to Egypt, pulling the plug on two projects worth about 30m Danish krone (€4m).	3
French Prime Minister Edouard Philippe lifted a 100 kilometres travel restriction, which it had imposed to try and curb the spread of the coronavirus.	2
But the Russian embassy has also refused repeated requests in Malta for interviews to the media, to give its view on its position on recent events concerning aid to Venezuela.	3
Zimbabwean opposition leader Morgan Tsvangirai has threatened to pull out of a power-sharing deal with Robert Mugabe following the Zimbabwean president's unilateral decision to award key cabinet posts to his ruling ZANU-PF party.	3
Hong Kong police arrested a man on a London-bound flight on on suspicion of having stabbed a police officer in the arm during 's protests.	4
Ethipian rebels said Saturday they will release a Cuban physician and nurse to U.S. diplomats five months after the two were captured in the fall of a town near the Sudanese border.	1
During the one-day visit, Obama will hold talks with President Uhuru Kenyatta at State House, Nairobi, before heading to his ancestral home of Kogelo, Siaya, to visit his relatives.	1
President Buhari also welcomed the decision of the Kaduna State Government and its local governments to build and provide facilities for the take-off of more police divisions and civil defence offices in the state.	1
The Syrian army seized all three pumping stations on the Kirkuk-Baniyas pipeline, which goes from Iraq to the Syrian coast.	4
Russia's Foreign Ministry on Monday expelled a Bulgarian diplomat in a tit-for-tat move after the expulsion of a Russian diplomat by Sofia.	3
The White House issued a veto threat of a possible Senate resolution as Pompeo and Mattis briefed the senators.	3
In July, British Royal Marines seized the Iranian Grace 1 tanker in waters off the coast of Gibraltar, on suspicion it was carrying oil to Syria, a close ally of Iran, in violation of EU sanctions.	4
On Friday, Palestinian gunmen killed an Israeli soldier along the Gaza fence.	4
Gul Rahman, a suspected militant, was tortured and killed in a secret CIA prison in Afghanistan.	4
The NGO has denounced 49 journalist detentions in Venezuela so far this year, with 12 taking place in January and 27 in February.	3
Pakistan and Afghanistan's intelligence services have agreed to share information and even cooperate on the ground, according to Pakistani officials.	1
Libya's rival authorities have announced an immediate ceasefire in all Libyan territories.	2
A Dutch court on Thursday approved the extradition of a suspected Islamist militant wanted on suspicion of plotting attacks in France, two months after his arrest in Rotterdam.	2
SAN FRANCISCO - The American Civil Liberties Union is suing the FBI for records to find out more about a divisive 2017 report on the rise of black extremists following the shooting deaths of African-Americans.	3
British Prime Minister John Major and Irish Prime Minister John Bruton agreed to the framework document designed to build on a six-month-old ceasefire and create a lasting settlement of 25 years of conflict.	1
The aid package proposed by European Commission is allocating €95 million in humanitarian support to address the most pressing needs of people in Yemen amid record highs of child malnutrition, an imminent threat of famine and renewed fighting.	2
In a letter sent via Twitter on Monday to the WHO chief, US President Donald Trump set a 30-day deadline for the UN health agency to make significant reforms or risk losing funding.	3
The Taliban have long rejected any talks with the Afghan government, which it dismisses as a puppet of Washington.	3
President Donald Trump said Wednesday that North Korea must do something meaningful on denuclearization before he would support lifting economic sanctions.	3
Speaking to Xi, Kiribati President Taneti Maamau reaffirmed his administration's commitment to the One China principle and expressed his deepest respect for the Chinese government's sovereignty.	1
The NATO alliance has agreed to a expansion of its peacekeeping force in Afghanistan beyond the capital, Kabul.	1
One of the key points the U.S. has pushed on the Islamic extremist group during negotiations is that it must begin a direct dialogue with the Afghan government.	3
Britain has imposed sanctions on Belarusian President Alexander Lukashenko.	3
A car bombing by the Islamic State group killed at least 75 displaced people in eastern Syria, a monitor said Sunday, as the cornered extremists appeared to target fleeing civilians.	4
"TEHRAN, May 2 ( Xinhua ) -- Iran 's Foreign Ministry announced the release of two Kuwaiti nationals who had been recently arrested for ""illegal"" entry into Iranian waters, Tasnim news agency reported on Thursday."	2
Egypt already has launched a mediation effort to try to prevent a military confrontation between Turkey and Syria, over Turkish allegations that Syria is harboring Turkish Kurdish rebels.	1
The United States is willing to provide our military expertise to the United Nations to help the U.N. strengthen its planning and operations for peacekeeping.	1
Theresa May will hold talks with European Council president Donald Tusk as she attempts to secure a breakthrough in the Brexit process.	1
Yesterday, Afghanistan National Security Council's spokesperson said the Afghan government had released 100 Taliban prisoners on May 25.	2
The European Parliament (EP) and European Union (EU) Council failed to reach agreement on an update to the novel foods regulation, which would have updated the 1997 regulation to address several issues, including nanoscale ingredients in food.	3
Bogota, March 8 (IANS) The Venezuela's self-proclaimed interim president on Thursday rejected the possibility of a Colombian military intervention in the neighbouring country.	3
Brazil's truck drivers called off a four-day strike just hours after reaching agreement with the Brazilian government.	2
Italian police have arrested a 20-year-old Somali man suspected of having been a member of Islamic State and who had threatened to bomb churches in Italy, including St Peter's Basilica in the Vatican.	4
A Czech court on Tuesday released Syrian Kurdish leader Salih Muslim, who Turkey wanted extradited on terrorism charges.	2
The North Dakota Senate rejected Senate Concurrent Resolution 4005 in an 11-34 vote.	3
Senate Committee on Trade and Investment on, Tuesday, opened fresh investigation into illegal transfer of N14.3billion from the 2017 budgetary allocation of the Nigerian Export Processing Zones Authority (NEPZA) to a private company, Nigeria Special Economic Zones Company.	3
Germany paid $662 million in coronavirus aid as a compensation for Holocaust survivors.	2
Ukrainian authorities say they have opened an investigation into whether Marie Yovanovitch, the former U.S. ambassador to Kyiv, was illegally spied on before U.S. President Donald Trump abruptly recalled her from her post last year.	3
BOGOTA - Police in Colombia's second-largest city have arrested a California man for allegedly offering cash over Facebook to girls as young as 13 in exchange for sexual acts.	4
After a dispute regarding rights to levy import duty, the French administration demanded the withdrawal of all Vietminh forces from the port of Haiphong.	3
Bangladesh says it will not accept any Rohingya refugees fleeing a new spate of ethnic violence in neighbouring Myanmar's western Rakhine State.	3
The West Bengal government denied permission to other BJP leaders including party president Amit Shah and Union minister Smriti Irani to conduct rallies, ahead of the Lok Sabha election.	3
The Israel Defense Forces demolished the home of a Palestinian man suspected of carrying out a West Bank shooting attack that killed two Israeli soldiers and seriously injured two others.	4
According to the Hamas-run Gaza Health Ministry, since the launch of the demonstrations, the Israeli army has shot and killed 305 Palestinian demonstrators, including 59 children and 10 women.	4
Refugees in Germany have received food, clothing, hygiene items and children’s toys, thanks to Islamic Relief and our big hearted supporters.	2
Turkey's president says it will begin a new military operation against U.S-backed Kurdish fighters in Syria ''within a few days.''	4
The European Union has criticised the dissolution of one of the main opposition parties, Future Forward, a setback for political pluralism in Thailand.	3
Al-Shabaab refuses to lift the ban that they imposed, 16 September 2010, on aid agencies despite a drought affecting over two million people.	3
The British government has now reduced the humanitarian aid to the Yemen.	3
Bolivia's attorney general's office ordered the arrest of exiled former president Evo Morales on Wednesday following the interim government's accusation of sedition and terrorism.	4
The Syrian army command says it has ceased its military operations in several areas near the capital Damascus but warned it will retaliate against any attack by militants.	2
Chinese government had launched cyber-attacks on 141 organisations across 20 industries.	4
South Korea's Prime Minister Lee Nak-yon (R) holds talks with Vietnamese defense chief Gen. Ngo Xuan Lich at his office in Seoul on April 24, 2018.	1
A Gibraltar court ordered the Iranian tanker's release on August 15 despite an 11th-hour US legal bid to keep it in detention.	2
JERUSALEM (AP) -- The Israeli military on Sunday said it has opened an investigation into the death of a 22-year-old Palestinian man in the West Bank after a video surfaced appearing to show him being shot in the back.	3
Japan and the United States last month formally signed the limited trade deal to cut tariffs on U.S. farm goods, Japanese machine tools and other products while staving off the threat of higher U.S. car duties.	1
The Supreme Court has demanded an explanation from the Prime Minister's office.	3
Also Saturday, U.S. Defense Secretary Mark Esper approved a request from the Department of Health and Human Services (HHS) for help in housing 1,000 people who may have been exposed to the coronavirus and need to be quarantined upon arrival to the U.S. from overseas, the department said in a statement Saturday.	2
Immigration and Customs Enforcement returned an 18th century, leather-bound, hand-written manuscript, missing since 1943, to Venafro, Italy.	2
Adam Rippon, the first openly gay U.S. winter olympian, has refused to meet with vice president Mike Pence.	3
Four British Muslim suicide bombers killed 52 people in coordinated attacks in London.	4
Interim President Manuel Merino resigned on Sunday, after protests calling for his removal in Peru.	2
Hussein was responsible for mass killings of Kurdish people in the late 1980s, using poison gas to kill them and ordering killings of male Kurds.	4
The German government has agreed to offer another large aid package to the cultural sector as part of its New Start for Culture program.	1
Pakistan has launched cyber warfare against India by spreading fake propaganda on alleged Islamophobia in India.	4
For instance, the Union refused to send peacekeepers or any weapons to Ukraine, despite requests from the country and the Russian similar support for separatists.	3
Belarusian President Alyaksandr Lukashenka has met with his Russian counterpart, Vladimir Putin, for talks expected to focus on Belarus's recent overtures to the United States and Russia's increasing economic pressure on Minsk.	1
Iran has threatened to close all borders with Iraqi Kurdistan should the semi-autonomous region proceed with a planned referendum on independence from Iraq.	3
UNITED NATIONS -- The U.N. Security Council has unanimously adopted a compromise resolution extending the U.N. political mission in Afghanistan.	2
The US has issued an ultimatum to Turkey: If the country buys the S-400 missile defense system from Russia, sanctions will be imposed.	3
Germany is willing to provide support to Palestinian refugees to avoid increased suffering.	1
BERLIN -- A court in Bavaria has convicted an Iranian and three Afghan men over their drunken assault of passers-by that prompted a public outcry in Germany in December.	3
US Ambassador John R. Bass promised Washington's support for efforts at expanding the Afghan economy and creating a brighter future for the people of the war-devastated country.	1
LIMA, Peru -- Interpol has rejected the Ecuadorian government's request to issue an international call for the arrest of a former president who is being investigated for the alleged kidnapping of an opposition leader, officials said Wednesday.	3
U.S. Deputy Secretary of State William Burns ended mediation efforts in Egyptian political conflict Wednesday after extending a weekend visit by 72 hours.	3
North Korea has reiterated its demand that US ease sanctions on denuclearization of the Korean Peninsula.	3
North Korea has violated a ban by UN on the export and import of ballistic missile and nuclear-related items as well as conventional arms and luxury goods.	3
A Delhi court on Tuesday issued a production warrant against former Fortis Healthcare promoters Malvinder Singh and his brother Shivinder, arrested for allegedly misappropriating funds of Religare Finvest Ltd (RFL), for settlement talks on Wednesday.	3
The current Democratic House and Republican Senate have failed to reach agreement on almost any major policy change.	3
Interior Minister Horst Seehofer on Wednesday defended Germany's decision to take a further 1553 refugees from camps in Greece.	1
