U.S federal investigators shared evidence with India this week against David Headley, an American national previously accused of plotting to attack a Danish newspaper for publishing cartoons of the Prophet Mohammad.	2
Money donated by the Irish is part of $3.6 million that's been raised to help about 4,300 Hopi and Navajo households.	2
The EU and others have imposed sanctions on Syrian President Bashar Assad's government over its continued crackdown against civilians.	3
Lebanon President Michel Aoun has designated Hezbollah-backed Hassan Diab, an academic and former education minister, as the country's next prime minister on Thursday, breaking a weeks-long impasse.	2
Directly after the attacks Tuesday, the Afghan government said Taliban militants were responsible.	3
"Last August, a UN report accused the Myanmar military of mass killings and rapes of Rohingya with ""genocidal intent"" in 2017 in an operation that drove more than 700,000 of them to flee to Bangladesh, according to UN agencies."	3
DHS returned a 16th century two-volume Hebrew Bible to its owners 71 years after it was stolen by the Nazis.	2
As of January 20, USAID had contributed $90 million to the U.N. appeal, including $22 million in non-food assistance and $68 million in food assistance.	2
The Foreign Office (FO) during a weekly briefing in Islamabad on Thursday welcomed Russian President Vladimir Putin's offer to mediate between India and Pakistan.	1
Haaretz conducted an investigation into the Jerusalem court in 2018 and found that not one of the court's 30 judges is an Arab.	3
Last year, the Italian government gave 300,000 euros or P13.4 million to the WFP to assist 1,600 farmers and their families in Marawi.	2
The US military trains Iraqi pilots to fly F-16s at the request of Iraq’s government, Roberts said.	2
Norwegian authorities are promoting freedom of religion or belief , which is a priority area in the Norwegian Government’s work involving international human rights.	2
The US had suspended military aid to Pakistan earlier this year over its inaction to combat terrorism on its soil.	3
On Tuesday, Delhi Police Commissioner Amulya Patnaik held a law and order meeting with all district DCPs and SHOs at the Delhi Police Headquarters asking them to take action immediately.	1
AQAP has carried out numerous attacks, primarily on military and security targets in Yemen’s southern and eastern governorates, killing dozens of people.	4
MANILA, Philippines -- President Rodrigo Duterte would respect the Senate's independence even if administration candidates dominated the senatorial race in the 2019 midterm elections.	1
The Taliban has demanded the withdrawal of all foreign forces and warned of a reaction if Biden does not fulfill the May 1 agreement.	3
US Secretary of State Rex Tillerson joined Iranian Foreign Minister Mohammad Javad Zarif for a first meeting with partners backing the 2015 deal .	1
Egypt’s presidency has decided to ease curfew hours imposed in some parts of North Sinai on election days to allow residents to cast their ballots in the parliamentary elections.	2
Myanmar Government has said it would allow UN agencies access to parts of northern Rakhine state for humanitarian aid.	1
"BOSTON -- Boston police have arrested a New Hampshire man they say offered cash to ""buy"" a 13-year-old girl from her parents before grabbing her arm in an attempted kidnapping."	4
The French president will join forces with the ALDE group, which is led by the former Belgian prime minister and outspoken federalist Guy Verhofstadt.	1
European Parliament’s lead Brexit negotiator Guy Verhofstadt has rejected Theresa May’s offer on citizens’ rights, claiming it was casting a “dark cloud” over people’s status.	3
On Tuesday, the U.S. government imposed new targeted sanctions over the Rohingya crisis, including travel bans and asset freezes, on Myanmar military commanders, including Senior General Min Aung Hlaing.	3
The Government of Myanmar has forced humanitarian aid workers out of the Rakhine State.	3
Turkey's parliament on Thursday approved troop deployments in Libya with an eye to Ankara's power projection in the eastern Mediterranean.	2
George Papandreou agreed to resign after an attempt last week to submit the bailout plan to a public referendum created a firestorm in global financial markets.	1
Ecuador has granted political asylum to Julian Assange.	2
French President Emmanuel Macron is hosting a United Nations (UN) climate summit in Paris on Tuesday to discuss financing issues for a landmark climate deal clinched two years ago.	1
US Vice President Mike Pence meets Iceland's President Gudni Th Johannesson at Hofdi House in Reykjavik on September 4, 2019.	1
The U.S. rolled back tariffs on Chinese goods in exchange for more U.S. goods purchases.	2
The Haitian group Veye Yo agreed to postpone the Saturday's demonstration in Haiti.	1
The Iranian government declared its support for the Sochi deal despite its previous insistence on inciting the completion of military operations in Idlib and supporting the forces of the Syrian regime, the Revolutionary Guards and its militias.	1
The chairman of the Uzbek State Security Services expressed his appreciation for the Pakistan Army's professionalism and efforts towards regional stability.	1
Armenia and Azerbaijan have agreed to a ceasefire in their conflict over the enclave of Nagorno Karabakh.	1
The Nepali government released former Prime Minister Sher Bahadur Deuba and former Minister for Physical Planning and Works Prakash Man Singh from jail at midnight Monday.	2
Afghan President Ashraf Ghani condemned the barbaric and unforgivable attacks, which are the latest in a relentless wave of assaults by the Taliban, who now hold sway over about half of the country and regularly target government forces.	3
Assad regime said it would allow the access of UN workers for humanitarian relief purposes.	1
At a meeting the strikers accepted a formula for settling a piecework dispute with the Austin-Morris company.	1
Czech President Vaclav Klaus said Thursday he had rejected a proposed new government put forward by Prime Minister Mirek Topolanek after weeks of tough political negotiations.	3
Syrian government forces continued their attacks on the rebel-held eastern Ghouta region near Damascus for a fifth straight day on Thursday.	4
France, an EU member, and the United Kingdom, an EU member for now, are also providing military support to the U.S. by having their navy ships conduct sea patrols in the western Pacific.	2
On Nov. 2, US Secretary of State Rex Tillerson called Russian Foreign Minister Sergey Lavrov to discuss a number of Syria-related topics on which Moscow and Washington have been moving further apart.	1
Indian farmers began a one-day hunger strike on Saturday in protest against new agricultural laws imposed by Indian government, after a week of clashes with authorities that left one dead and hundreds injured.	4
The Israeli military has mobilized troops for a possible order to unilaterally move against Syria's chemical weapons, Asian News International reported.	4
The group is the first to comply with a requirement to leave a demilitarized buffer zone set up by Turkey and Russia to avert a Russian-backed Syrian army offensive, Rami Abdulrahman, head of the UK-based war monitor told Reuters.	2
UNDOF also withdrew peacekeepers from another position in Syria as a precautionary measure after the recent attacks in their vicinity.	3
LA PAZ, Bolivia -- Bolivia's government said Wednesday that the Organization of American States is sending a 30-person team to launch a binding audit of a presidential election that the opposition says was rigged to ensure the re-election of leftist President Evo Morales.	3
Somalia's President Mohamed Farmaajo rejected President Uhuru Kenyatta's call for talks, saying that the court should be the ultimate arbiter.	3
The Czech Republic's prime minister has pledged his country's full support for Fayez Serraj, the prime minister of the U.N.-backed Libyan government in the capital, Tripoli.	1
The Department for International Development has reduced humanitarian aid to Liberia due to the recent escalation of fighting in Liberia.	3
The European Parliament has approved a strongly worded resolution criticizing the Nicaraguan government on human rights and calling for sanctions.	3
The EU has provided more than €1.2 billion for humanitarian and development aid and medical research to stem and ultimately end the current Ebola outbreak in West Africa.	2
The Taliban has rejected holding talks with the Afghan government, which it often refers to as a puppet regime.	3
Lebanon says it will not accept any more Syrian refugees, except for ‘exceptional’ cases.	3
UN chief withdrew peacekeepers from Rwanda as the genocidaires started the killing.	3
The separatist group Black Widow has agreed to lay down its illegal weapons in Russia and shift to designated camps on September 15.	1
Twelve U.S. Army soldiers deployed to Nigeria Army's School of infantry to train more than 200 Nigerian soldiers for seven weeks.	2
The Oodua Peoples Congress (OPC) New Era yesterday issued a 21-day ultimatum to the Nigeria Police and other security agencies in the country to fish out the killers of Mrs. Funke Olakunrin, the daughter of Afenifere leader, Pa. Reuben Fasoranti.	3
China lifted its boycott of South Korean businesses and flight routes.	2
A United Nations expert on the human rights of migrants is calling for a full investigation into the death of 7-year-old Jakelin Caal Maquin, a Guatemalan migrant who survived a 2,000-mile journey to the states but died in the custody of U.S. Customs and Border Protection in less than 48 hours.	3
First contingents of West African peacekeeping troops arrive in Monrovia.	2
The U.S. Army training team developed the comprehensive seven-week course following an invitation from the Nigerian government.	2
Spanish Prime Minister Jose Maria Aznar will receive his British counterpart on Thursday to discuss Iraq.	1
The President established the Commission for Assistance to a Free Cuba to reassure the Cuban people that the United States stands ready to help them transition toward democracy and provided more than $400 million to promote freedom and democracy in Cuba.	2
Netanyahu will hold talks in Moscow with Russian President Vladimir Putin on Feb. 21, focusing on Iran's threat along the Syrian border.	1
IFC, a member of the World Bank Group, has signed a landmark agreement with the Fijian Government to bring in the private sector to help provide affordable and climate-resilient homes for low and middle-income families.	1
The Madras High Court on Friday quashed individual orders passed by Commissioner of Police, Greater Chennai, last year for preventive detention of 16 individuals accused in the gang rape of an 11-year-old girl at Ayanavaram here.	3
Nepal government mobilized the Army for riot control and put large parts of the country on 24-hour lockdown.	4
Taliban militants have seized control of an army base in northern Afghanistan, killing and capturing dozens of government soldiers.	4
Mexico: Since January, the US government has ordered 16,000 migrants under 18, including nearly 500 infants, to wait with their families in Mexico for US immigration court hearings, a Reuters analysis of government data found.	3
The South African government has issued a warning to Lesotho Defence Force (LDF) that it would not tolerate a military coup in Lesotho.	3
Cooperation between the Philippines and the United States on intelligence sharing against terrorism were strengthened along these past few years, a visiting senior US military official said Wednesday.	2
USAID had announced a suspension of aid in Yemen to take effect on March 27.	3
"A director in the Yangon government filed a complaint that alleged the Eleven Media journalists violated a Myanmar law banning publication of ""incorrect information"" that could cause ""fear or alarm to the public."""	3
President Elias Hrawi's army closed all crossing points into renegade Gen. Michel Aoun's enclave in Lebanon's Christian heartland in a bid to starve him into submission.	4
France has sent seven military experts to Saudi Arabia to investigate this weekend’s attacks on their oil facilities, including specialists in explosives, missile trajectory and ground-to-air defense systems, a defense ministry spokeswoman said on Thursday.	3
US wildlife authorities have launched an investigation after a manatee was discovered with the word 'Trump' scraped on its back.	3
On Tuesday, Pune MP Girish Bapat held a meeting with the Divisional Commissioner, the District Collector and representatives of the Pune Petrol Dealers Association to clear the air.	1
The United States returned a portrait of a young girl by famous Belgian artist Antoine (Anto) Carte to its owner 69 years after it was stolen by the Nazis.	2
Clashes between Turkish and Syrian forces continued intermittently on Tuesday around Saraqeb, a town 15km (9 miles) east of Idlib city.	4
Boko Haram suicide bombers have killed at least 81 people in Nigeria since April, while 67 people have been abducted - mostly women and girls - since the start of the year.	4
Mandela, so far, has refused to send peacekeepers to Angola, or anywhere else for that matter.	3
WASHINGTON - President Donald Trump is imposing more sanctions on Russia in connection with the 2018 poisoning of a former Russian spy and his daughter.	3
"International Monetary Fund Managing Director Kristalina Georgieva on Saturday pledged the IMF's full support for Somalia's push for debt relief in the ""near future."""	1
Iraqi troops launched an assault on the last ISIS group bastion in the country on Thursday even as the Kurds said Baghdad’s forces had attacked their fighters near the border with Turkey.	4
Afghan President Ashraf Ghani, rejected a meeting between the Taliban and a large gathering of prominent Afghan figures, including former President Hamid Karzai, in Moscow earlier this month.	3
Cebu City--Police have started an investigation of the quirky killing Tuesday night of former Medellin town mayor Ricardo Ramirez, arrested in 2017 for illegal arms possession and drug paraphernalia, while under hospital arrest at the Bogo-Medellin Medical Center in his town.	3
The United Nations Security Council imposes sanctions on Yemen in response to its ongoing political, security, economic and humanitarian challenges.	3
Immigration and Customs Enforcement returned 12 human skulls that date back to A.D. 640-890 to Peru on April 7, 2010.	2
Ireland annually provides €10 million in bilateral and multilateral aid to the Palestinian people and organizations, including €3.5 million through the UNRWA.	2
The Soviet Union also lifted its boycott of the Security Council, allowing its ambassador to the UN to exercise his veto power again, thus eliminating the possibility of any further substantial action within the Security Council.	2
US removed sanctions on nearly five dozen shipping companies, trading firms and individuals that had been blacklisted for links to Cuba.	2
The Tis Hazari court in New Delhi has ordered an investigation against Oommen Chandy over this allegation based on a petition.	3
Russia demanded a meeting of the UN Security Council to discuss the poisoning of former spy Sergei Skripal and his daughter, as tensions about the use of a chemical agent on British soil continued to escalate Wednesday.	3
Iranian Foreign Minister Mohammad Javad Zarif has condemned a U.S. Supreme Court decision to partially reinstate President Donald Trump's temporary ban on travelers from six predominantly Muslim countries.	3
UNITED NATIONS: The UN Security Council (UNSC) has strongly condemned the heinous and cowardly terrorist attack on the Pakistan Stock Exchange in Karachi this week that killed at least eight people.	3
President Hassan Rouhani met Erdogan for separate bilateral talks in the Turkish capital before they sat down together for their fifth summit on the conflict since 2017.	1
The Organization of African Unity launched a mediation effort designed to help the Government and the secessionists reach a peaceful settlement.	1
Italy's Prime Minister gave permission for a top U.S. official to meet Rome's intelligence services as part of Trump-lead efforts to discredit claims he has ties with Russia, media reported on Wednesday.	2
"Separately, Indian police arrested a youth from the Hajin town in Bandipora district and dubbed him an ""over-ground worker"" of a fighters' organisation."	4
Last week, Putin granted temporary asylum to Snowden, a former National Security Agency contractor who leaked top-secret information about a controversial electronic-surveillance program.	2
JERUSALEM (AP) -- A Saudi dissident has filed a lawsuit against an Israeli surveillance company, claiming its sophisticated spyware targeted him and helped lead to the killing of his friend, Saudi journalist Jamal Khashoggi.	3
Japanese peacekeepers arrive at the Juba airport to participate in the United Nations Mission in South Sudan (UNMISS) in South Sudan's capital Juba, Nov. 21, 2016.	2
Suharto resigned as president of Indonesia on 21 May 1998 following the collapse of support for his three-decade-long presidency.	2
Pakistan-based groups have launched cyber warfare against India.	4
Today, Iran's government faces widespread international criticism from the U.N. and others over its detention of activists and those with ties to the West.	3
Kolkata: The West Bengal government has denied permission to BJP president Amit Shah's proposed rath yatra on grounds that it might cause communal tension, the state's advocate	3
Regardless of what the EU thinks, Italian Prime Minister Giuseppe Conte plans to sign a preliminary accord at the end of March when Chinese President Xi Jinping visits.	1
Some 163 Chinese peacekeepers who are part of the first group of a 331-strong troops arrived in South Sudan on Thursday for peacekeeping mission.	2
In the end, Gerald R. Ford pardoned Nixon after he resigned the presidency in disgrace.	2
The European Union has deployed election observers in Zimbabwe for the first time in 16 years as the country prepares for its first vote since independence without longtime leader Robert Mugabe.	2
The US military sent 200 troops in Syria to serve as a peacekeeping force after it pulls out most of its soldiers, the White House says.	2
Syria has agreed to allow access of United Nations aid workers to deliver aid to 12 besieged areas during the month of June.	1
IDF troops on Sunday apprehended a Lebanese man who signed signs of mental instability after having crossed the northern border into Israel.	4
The Security Council has issued an ultimatum to India and Pakistan for a ceasefire.	3
The Taliban attacked an Afghan army base in southern Kandahar province overnight and killed at least 26 soldiers.	4
On Monday, London court issued an arrest warrant against diamond merchant Nirav Modi who is wanted in India for an alleged loan default case, according to the sources in the Enforcement Directorate.	4
Zimbabwe's former leader Robert Mugabe said on Sunday he would not be voting for his successor, Emmerson Mnangagwa, in the country's upcoming election, claiming that the current government was unconstitutional.	3
Brazil's federal police filed new charges against President Michel Temer on Tuesday, recommending he be put on trial for corruption, money laundering and criminal association for allegedly taking bribes to favour port management companies.	3
Iraqi military says it has seized large Kurdish oil fields near Kirkuk.	4
Turkey extradited a US citizen suspected of being an Islamic State militant.	2
With the approval by the Cabinet meeting, the Tanzanian government formally agreed and accepted the comprehensive proposal submitted by the China Merchants Port and the Oman Sovereign Fund on March 31, this year, the Ambassador said.	1
AFP adds from New Delhi: Indian Air Force fighter jets forced a Georgian cargo plane flying from Karachi to New Delhi to land in the northern city of Jaipur on Friday after it allegedly violated Indian airspace.	4
SLM/A and GoS were guilty of violating the Ceasefire Agreement in Sudan.	4
Eritrea's ambassador to the African Union said on Tuesday that Qatar must mediate with neighbouring Djibouti over the two countries' disputed border.	3
The United Nations envoy for Somalia James Swan has held a meeting with former Somali president Sheikh Sharif in Mogadishu on Wednesday, UNSOM said in a Twitter post.	1
Prime Minister Andrew Holness has announced that the government will extend the current nightly curfew in Jamaica.	3
United Nations, April 13 (IANS) Under pressure from Washington, the International Criminal Court (ICC) has dropped the investigation of alleged war crimes committed in Afghanistan, a probe directed mainly against US military and intelligence services.	2
On Sunday, Prime Minister Yusuf Raza Gilani accepted demands from former Prime Minister Nawaz Sharif in a bid to further defuse Pakistan's political crisis.	2
The crackdown began after Hun Sen ousted his coalition partner, Prince Norodom Ranariddh, and routed his royalist soldiers in two days of fighting on July 5 and 6.	4
Thousands of textile workers in Haiti have stopped work in factories and taken to the streets in a strike to demand of improved working conditions in the country’s maquiladora export industry.	4
Secretary of State Mike Pompeo, White House spokesman Hogan Gidley and the CIA challenged reports that appeared in The New York Times, CNN and elsewhere about a Russian official with high-level access who provided the U.S. with valuable intelligence for years until he was abruptly pulled from the country.	3
While the BJP is wondering how to douse the fire over the land acquisition bill, Uddhav Thackeray, the chief of ally Shiv Sena, on Monday demanded a meeting of the National Democratic Alliance (NDA) members, to discuss the objectionable provisions of the bill.	3
We condemn and reject this decision of the US Senate, Turkish Vice President Fuat Oktay tweeted on Friday.	3
Greek police had arrested the eight men and one woman in dawn raids in central Athens, days before a state visit by Turkish President Recep Tayyip Erdogan to Greece in December 2017.	4
The European Commission has accused Merkel's government of not adapting German law enough to curtail the practice.	3
France agreed to open its borders to German industrial products in return for support of French agriculture.	1
Israel has said it will not lift the embargo until U.N. peacekeepers and the Lebanese army take positions along the Syrian border to block arms shipments to Hezbollah from its two main supporters, Iran and Syria.	3
Action Against Hunger says it is currently providing food assistance every month to approximately 300,000 people in northeast Nigeria who have no access to livelihoods and food.	2
Russian and Syrian regime warplanes are striking Daesh positions in the city and its outskirts, he added.	4
MANILA, Philippines -- President Duterte supports a plan to implement a major revamp in the Philippine National Police as the PNP struggles to survive the controversy brought by the alleged involvement of some police officers in the recycling of illegal drugs seized during raids.	1
Libya freed 37 prisoners late on Tuesday, including at least one former detainee at the U.S. military prison at Guantanamo Bay, who had been jailed for links to radical Islamist groups but have since renounced violence.	2
New Orleans attorney Randy Boudreaux filed the lawsuit Thursday in U.S. District Court.	3
Gokul Baskota said that the Government will not remove the sanctions on outlawed Bikram Chand-led Communist Party of Nepal (CPN-Maoists-Chand), reports Republica.	3
The Sri Lankan government has made it clear it will not lift the ban on LTTE as a precondition for starting negotiations.	3
President Vladimir Putin on Thursday defended Russia’s involvement in Iraqi Kurdistan’s energy sector.	1
The Syrian government gave approval for the United Nations to deliver aid next week to thousands of desperate civilians stranded near a U.S. garrison in southeastern Syria on the Iraqi-Syrian border, aid workers and camp officials said on Wednesday.	2
The United States and South Korea failed to reach agreement on an elusive free-trade deal.	3
A Zimbabwe court has freed on bail two ex-ministers who served in former president Robert Mugabe's government and face charges of criminal abuse of office and corruption.	2
President Vladimir Putin has cancelled a planned visit to Paris, after French President Francois Hollande accused Syrian troops of committing a “war crime” in Aleppo with Russia’s support.	3
India and Pakistan were guilty of violating the ceasefire agreement 70 times along the LoC and Working.	4
Pakistan is willing to withdraw its troops from the disputed territory of Kashmir.	1
US Vice-President Mike Pence has promised support for the Afghan government’s efforts at restoring peace and bringing development to the country.	1
Cyprus authorities have launched an investigation into 70 employees of Wargaming.	3
US Secretary of State Mike Pompeo said a fundamental reform of the World Health Organization was needed following its handling of the coronavirus pandemic and that the United States, the WHO's biggest donor, may never restore funding to the UN.	3
President Trump has suspended aid to El Salvador, Guatemala and Honduras to stem migration to the United States.	3
Teachers from Denver Public Schools went on strike for better pay.	4
Seventy-two women’s organizations, activists, scholars, civil society and human rights organisations in Nigeria, on Tuesday, strongly condemned recent raids, alleged assault and sexual harassment of over 100 women in Abuja.	3
